Sample Number,ClassName,Snippet Number,Method,Exist,Description,Full Description
0,RTFEditorKit,1,"void insertString(DocumentFilter.FilterBypass fb, int offset, String text, AttributeSet attr)",False,,NULL
0,RTFEditorKit,2,"void remove(FilterBypass fb, int offset, int length)",False,,NULL
0,RTFEditorKit,3,"void replace(FilterBypass fb, int offset, int length, String text, AttributeSet attrs)",False,,NULL
0,RTFEditorKit,4,void endFilterBypass(FilterBypass fb),False,,NULL
0,RTFEditorKit,5,"void startFilterBypass(FilterBypass fb, int offset, int length)",False,,NULL
