ClassName,Method,Return Type,Description
X500Principal,equals(Object o),boolean,Compares the specified Object with this X500Principal for equality.
X500Principal,getEncoded(),byte[],Returns the distinguished name in ASN.1 DER encoded form.
X500Principal,getName(),String,Returns a string representation of the X.500 distinguished name using the format defined in RFC 2253.
X500Principal,getName(String format),String,Returns a string representation of the X.500 distinguished name using the specified format.
X500Principal,"getName(String format, Map<String,String> oidMap)",String,Returns a string representation of the X.500 distinguished name using the specified format.
X500Principal,hashCode(),int,Return a hash code for this X500Principal.
X500Principal,toString(),String,Return a user-friendly string representation of this X500Principal.
X500PrivateCredential,destroy(),void,"Clears the references to the X.509 certificate, private key and the KeyStore alias in this object."
X500PrivateCredential,getAlias(),String,Returns the KeyStore alias.
X500PrivateCredential,getCertificate(),X509Certificate,Returns the X.509 certificate.
X500PrivateCredential,getPrivateKey(),PrivateKey,Returns the PrivateKey.
X500PrivateCredential,isDestroyed(),boolean,Determines if the references to the X.509 certificate and private key in this object have been cleared.
