ClassName,Method,Return Type,Description
DefaultCaret,paint(Graphics g),void,Renders the caret as a vertical line.
DefaultCaret,positionCaret(MouseEvent e),protected void,"Tries to set the position of the caret from the coordinates of a mouse event, using viewToModel()."
DefaultCaret,removeChangeListener(ChangeListener l),void,Removes a listener that was tracking caret position changes.
DefaultCaret,repaint(),protected void,Cause the caret to be painted.
DefaultCaret,setBlinkRate(int rate),void,Sets the caret blink rate.
DefaultCaret,setDot(int dot),void,"Sets the caret position and mark to the specified position, with a forward bias."
DefaultCaret,"setDot(int dot, Position.Bias dotBias)",void,"Sets the caret position and mark to the specified position, with the specified bias."
DefaultCaret,setMagicCaretPosition(Point p),void,Saves the current caret position.
DefaultCaret,setSelectionVisible(boolean vis),void,Changes the selection visibility.
DefaultCaret,setUpdatePolicy(int policy),void,Sets the caret movement policy on the document updates.
DefaultCaret,setVisible(boolean e),void,"Sets the caret visibility, and repaints the caret."
DefaultCaret,toString(),String,Returns a String representing this Rectangle and its values.
DefaultEditorKit,createCaret(),Caret,Fetches a caret that can navigate through views produced by the associated ViewFactory.
DefaultEditorKit,createDefaultDocument(),Document,Creates an uninitialized text storage model (PlainDocument) that is appropriate for this type of editor.
DefaultEditorKit,getActions(),Action[],Fetches the set of commands that can be used on a text component that is using a model and view produced by this kit.
DefaultEditorKit,getContentType(),String,Gets the MIME type of the data that this kit represents support for.
DefaultEditorKit,getViewFactory(),ViewFactory,Fetches a factory that is suitable for producing views of any models that are produced by this kit.
DefaultEditorKit,"read(InputStream in, Document doc, int pos)",void,Inserts content from the given stream which is expected to be in a format appropriate for this kind of content handler.
DefaultEditorKit,"read(Reader in, Document doc, int pos)",void,"Inserts content from the given stream, which will be treated as plain text."
DefaultEditorKit,"write(OutputStream out, Document doc, int pos, int len)",void,Writes content from a document to the given stream in a format appropriate for this kind of content handler.
DefaultEditorKit,"write(Writer out, Document doc, int pos, int len)",void,Writes content from a document to the given stream as plain text.
DefaultEditorKit.BeepAction,actionPerformed(ActionEvent e),void,The operation to perform when this action is triggered.
DefaultEditorKit.CopyAction,actionPerformed(ActionEvent e),void,The operation to perform when this action is triggered.
DefaultEditorKit.CutAction,actionPerformed(ActionEvent e),void,The operation to perform when this action is triggered.
DefaultEditorKit.DefaultKeyTypedAction,actionPerformed(ActionEvent e),void,The operation to perform when this action is triggered.
DefaultEditorKit.InsertBreakAction,actionPerformed(ActionEvent e),void,The operation to perform when this action is triggered.
DefaultEditorKit.InsertContentAction,actionPerformed(ActionEvent e),void,The operation to perform when this action is triggered.
DefaultEditorKit.InsertTabAction,actionPerformed(ActionEvent e),void,The operation to perform when this action is triggered.
DefaultEditorKit.PasteAction,actionPerformed(ActionEvent e),void,The operation to perform when this action is triggered.
DefaultFormatter,clone(),Object,Creates a copy of the DefaultFormatter.
DefaultFormatter,getAllowsInvalid(),boolean,Returns whether or not the value being edited is allowed to be invalid for a length of time.
DefaultFormatter,getCommitsOnValidEdit(),boolean,Returns when edits are published back to the JFormattedTextField.
DefaultFormatter,getDocumentFilter(),protected DocumentFilter,Returns the DocumentFilter used to restrict the characters that can be input into the JFormattedTextField.
DefaultFormatter,getNavigationFilter(),protected NavigationFilter,Returns the NavigationFilter used to restrict where the cursor can be placed.
DefaultFormatter,getOverwriteMode(),boolean,Returns the behavior when inserting characters.
DefaultFormatter,getValueClass(),Class<?>,Returns that class that is used to create new Objects.
DefaultFormatter,install(JFormattedTextField ftf),void,Installs the DefaultFormatter onto a particular JFormattedTextField.
DefaultFormatter,setAllowsInvalid(boolean allowsInvalid),void,"Sets whether or not the value being edited is allowed to be invalid for a length of time (that is, stringToValue throws a ParseException)."
DefaultFormatter,setCommitsOnValidEdit(boolean commit),void,Sets when edits are published back to the JFormattedTextField.
DefaultFormatter,setOverwriteMode(boolean overwriteMode),void,Configures the behavior when inserting characters.
DefaultFormatter,setValueClass(Class<?> valueClass),void,Sets that class that is used to create new Objects.
DefaultFormatter,stringToValue(String string),Object,Converts the passed in String into an instance of getValueClass by way of the constructor that takes a String argument.
DefaultFormatter,valueToString(Object value),String,Converts the passed in Object into a String by way of the toString method.
DefaultFormatterFactory,getDefaultFormatter(),JFormattedTextField.AbstractFormatter,"Returns the JFormattedTextField.AbstractFormatter to use as a last resort, eg in case a display, edit or null JFormattedTextField.AbstractFormatter has not been specified."
DefaultFormatterFactory,getDisplayFormatter(),JFormattedTextField.AbstractFormatter,"Returns the JFormattedTextField.AbstractFormatter to use if the JFormattedTextField is not being edited and either the value is not-null, or the value is null and a null formatter has has not been specified."
DefaultFormatterFactory,getEditFormatter(),JFormattedTextField.AbstractFormatter,"Returns the JFormattedTextField.AbstractFormatter to use if the JFormattedTextField is being edited and either the value is not-null, or the value is null and a null formatter has has not been specified."
DefaultFormatterFactory,getFormatter(JFormattedTextField source),JFormattedTextField.AbstractFormatter,"Returns either the default formatter, display formatter, editor formatter or null formatter based on the state of the JFormattedTextField."
DefaultFormatterFactory,getNullFormatter(),JFormattedTextField.AbstractFormatter,Returns the formatter to use if the value is null.
DefaultFormatterFactory,setDefaultFormatter(JFormattedTextField.AbstractFormatter atf),void,"Sets the JFormattedTextField.AbstractFormatter to use as a last resort, eg in case a display, edit or null JFormattedTextField.AbstractFormatter has not been specified."
DefaultFormatterFactory,setDisplayFormatter(JFormattedTextField.AbstractFormatter atf),void,"Sets the JFormattedTextField.AbstractFormatter to use if the JFormattedTextField is not being edited and either the value is not-null, or the value is null and a null formatter has has not been specified."
DefaultFormatterFactory,setEditFormatter(JFormattedTextField.AbstractFormatter atf),void,"Sets the JFormattedTextField.AbstractFormatter to use if the JFormattedTextField is being edited and either the value is not-null, or the value is null and a null formatter has has not been specified."
DefaultFormatterFactory,setNullFormatter(JFormattedTextField.AbstractFormatter atf),void,Sets the formatter to use if the value of the JFormattedTextField is null.
DefaultHighlighter,"addHighlight(int p0, int p1, Highlighter.HighlightPainter p)",Object,Adds a highlight to the view.
DefaultHighlighter,"changeHighlight(Object tag, int p0, int p1)",void,Changes a highlight.
DefaultHighlighter,deinstall(JTextComponent c),void,Called when the UI is being removed from the interface of a JTextComponent.
DefaultHighlighter,getDrawsLayeredHighlights(),boolean,NULL
DefaultHighlighter,getHighlights(),Highlighter.Highlight[],Makes a copy of the highlights.
DefaultHighlighter,install(JTextComponent c),void,Called when the UI is being installed into the interface of a JTextComponent.
DefaultHighlighter,paint(Graphics g),void,Renders the highlights.
DefaultHighlighter,"paintLayeredHighlights(Graphics g, int p0, int p1, Shape viewBounds, JTextComponent editor, View view)",void,When leaf Views (such as LabelView) are rendering they should call into this method.
DefaultHighlighter,removeAllHighlights(),void,Removes all highlights.
DefaultHighlighter,removeHighlight(Object tag),void,Removes a highlight from the view.
DefaultHighlighter,setDrawsLayeredHighlights(boolean newValue),void,"If true, highlights are drawn as the Views draw the text."
DefaultHighlighter.DefaultHighlightPainter,getColor(),Color,Returns the color of the highlight.
DefaultHighlighter.DefaultHighlightPainter,"paint(Graphics g, int offs0, int offs1, Shape bounds, JTextComponent c)",void,Paints a highlight.
DefaultHighlighter.DefaultHighlightPainter,"paintLayer(Graphics g, int offs0, int offs1, Shape bounds, JTextComponent c, View view)",Shape,Paints a portion of a highlight.
DefaultStyledDocument,addDocumentListener(DocumentListener listener),void,Adds a document listener for notification of any changes.
DefaultStyledDocument,"addStyle(String nm, Style parent)",Style,Adds a new style into the logical style hierarchy.
DefaultStyledDocument,create(DefaultStyledDocument.ElementSpec[] data),protected void,Initialize the document to reflect the given element structure (i.e.
DefaultStyledDocument,createDefaultRoot(),protected AbstractDocument.AbstractElement,Creates the root element to be used to represent the default document structure.
DefaultStyledDocument,getBackground(AttributeSet attr),Color,Gets the background color from an attribute set.
DefaultStyledDocument,getCharacterElement(int pos),Element,Gets a character element based on a position.
DefaultStyledDocument,getDefaultRootElement(),Element,Gets the default root element.
DefaultStyledDocument,getFont(AttributeSet attr),Font,Gets the font from an attribute set.
DefaultStyledDocument,getForeground(AttributeSet attr),Color,Gets the foreground color from an attribute set.
DefaultStyledDocument,getLogicalStyle(int p),Style,Fetches the logical style assigned to the paragraph represented by the given position.
DefaultStyledDocument,getParagraphElement(int pos),Element,Gets the paragraph element at the offset pos.
DefaultStyledDocument,getStyle(String nm),Style,Fetches a named style previously added.
DefaultStyledDocument,getStyleNames(),Enumeration<?>,Fetches the list of of style names.
DefaultStyledDocument,"insert(int offset, DefaultStyledDocument.ElementSpec[] data)",protected void,Inserts new elements in bulk.
DefaultStyledDocument,"insertUpdate(AbstractDocument.DefaultDocumentEvent chng, AttributeSet attr)",protected void,Updates document structure as a result of text insertion.
DefaultStyledDocument,removeDocumentListener(DocumentListener listener),void,Removes a document listener.
DefaultStyledDocument,removeElement(Element elem),void,Removes an element from this document.
DefaultStyledDocument,removeStyle(String nm),void,Removes a named style previously added to the document.
DefaultStyledDocument,removeUpdate(AbstractDocument.DefaultDocumentEvent chng),protected void,Updates document structure as a result of text removal.
DefaultStyledDocument,"setCharacterAttributes(int offset, int length, AttributeSet s, boolean replace)",void,Sets attributes for some part of the document.
DefaultStyledDocument,"setLogicalStyle(int pos, Style s)",void,Sets the logical style to use for the paragraph at the given position.
DefaultStyledDocument,"setParagraphAttributes(int offset, int length, AttributeSet s, boolean replace)",void,Sets attributes for a paragraph.
DefaultStyledDocument,styleChanged(Style style),protected void,Called when any of this document's styles have changed.
DefaultStyledDocument.AttributeUndoableEdit,redo(),void,Redoes a change.
DefaultStyledDocument.AttributeUndoableEdit,undo(),void,Undoes a change.
DefaultStyledDocument.ElementSpec,getArray(),char[],Gets the array of characters.
DefaultStyledDocument.ElementSpec,getAttributes(),AttributeSet,Gets the element attributes.
DefaultStyledDocument.ElementSpec,getDirection(),short,Gets the direction.
DefaultStyledDocument.ElementSpec,getLength(),int,Gets the length.
DefaultStyledDocument.ElementSpec,getOffset(),int,Gets the starting offset.
DefaultStyledDocument.ElementSpec,getType(),short,Gets the element type.
DefaultStyledDocument.ElementSpec,setDirection(short direction),void,Sets the direction.
DefaultStyledDocument.ElementSpec,setType(short type),void,Sets the element type.
DefaultStyledDocument.ElementSpec,toString(),String,Converts the element to a string.
DocumentFilter,"insertString(DocumentFilter.FilterBypass fb, int offset, String string, AttributeSet attr)",void,Invoked prior to insertion of text into the specified Document.
DocumentFilter,"remove(DocumentFilter.FilterBypass fb, int offset, int length)",void,Invoked prior to removal of the specified region in the specified Document.
DocumentFilter,"replace(DocumentFilter.FilterBypass fb, int offset, int length, String text, AttributeSet attrs)",void,Invoked prior to replacing a region of text in the specified Document.
DocumentFilter.FilterBypass,getDocument(),abstract Document,Returns the Document the mutation is occurring on.
DocumentFilter.FilterBypass,"insertString(int offset, String string, AttributeSet attr)",abstract void,"Inserts the specified text, bypassing the DocumentFilter."
DocumentFilter.FilterBypass,"remove(int offset, int length)",abstract void,"Removes the specified region of text, bypassing the DocumentFilter."
DocumentFilter.FilterBypass,"replace(int offset, int length, String string, AttributeSet attrs)",abstract void,"Deletes the region of text from offset to offset + length, and replaces it with text."
EditorKit,clone(),Object,Creates a copy of the editor kit.
EditorKit,createCaret(),abstract Caret,Fetches a caret that can navigate through views produced by the associated ViewFactory.
EditorKit,createDefaultDocument(),abstract Document,Creates an uninitialized text storage model that is appropriate for this type of editor.
EditorKit,deinstall(JEditorPane c),void,Called when the kit is being removed from the JEditorPane.
EditorKit,getActions(),abstract Action[],Fetches the set of commands that can be used on a text component that is using a model and view produced by this kit.
EditorKit,getContentType(),abstract String,Gets the MIME type of the data that this kit represents support for.
EditorKit,getViewFactory(),abstract ViewFactory,Fetches a factory that is suitable for producing views of any models that are produced by this kit.
EditorKit,install(JEditorPane c),void,Called when the kit is being installed into the a JEditorPane.
EditorKit,"read(InputStream in, Document doc, int pos)",abstract void,Inserts content from the given stream which is expected to be in a format appropriate for this kind of content handler.
EditorKit,"read(Reader in, Document doc, int pos)",abstract void,Inserts content from the given stream which is expected to be in a format appropriate for this kind of content handler.
EditorKit,"write(OutputStream out, Document doc, int pos, int len)",abstract void,Writes content from a document to the given stream in a format appropriate for this kind of content handler.
EditorKit,"write(Writer out, Document doc, int pos, int len)",abstract void,Writes content from a document to the given stream in a format appropriate for this kind of content handler.
ElementIterator,clone(),Object,Clones the ElementIterator.
ElementIterator,current(),Element,Fetches the current Element.
ElementIterator,depth(),int,Fetches the current depth of element tree.
ElementIterator,first(),Element,Fetches the first element.
ElementIterator,next(),Element,Fetches the next Element.
ElementIterator,previous(),Element,Fetches the previous Element.
FieldView,adjustAllocation(Shape a),protected Shape,Adjusts the allocation given to the view to be a suitable allocation for a text field.
FieldView,getFontMetrics(),protected FontMetrics,Fetches the font metrics associated with the component hosting this view.
FieldView,getPreferredSpan(int axis),float,Determines the preferred span for this view along an axis.
FieldView,getResizeWeight(int axis),int,Determines the resizability of the view along the given axis.
FieldView,"insertUpdate(DocumentEvent changes, Shape a, ViewFactory f)",void,Gives notification that something was inserted into the document in a location that this view is responsible for.
FieldView,"modelToView(int pos, Shape a, Position.Bias b)",Shape,Provides a mapping from the document model coordinate space to the coordinate space of the view mapped to it.
FieldView,"paint(Graphics g, Shape a)",void,Renders using the given rendering surface and area on that surface.
FieldView,"removeUpdate(DocumentEvent changes, Shape a, ViewFactory f)",void,Gives notification that something was removed from the document in a location that this view is responsible for.
FieldView,"viewToModel(float fx, float fy, Shape a, Position.Bias[] bias)",int,Provides a mapping from the view coordinate space to the logical coordinate space of the model.
FlowView,"calculateMinorAxisRequirements(int axis, SizeRequirements r)",protected SizeRequirements,Calculate requirements along the minor axis.
FlowView,"changedUpdate(DocumentEvent changes, Shape a, ViewFactory f)",void,Gives notification from the document that attributes were changed in a location that this view is responsible for.
FlowView,createRow(),protected abstract View,Create a View that should be used to hold a a rows worth of children in a flow.
FlowView,getFlowAxis(),int,Fetches the axis along which views should be flowed.
FlowView,getFlowSpan(int index),int,Fetch the constraining span to flow against for the given child index.
FlowView,getFlowStart(int index),int,Fetch the location along the flow axis that the flow span will start at.
FlowView,getViewIndexAtPosition(int pos),protected int,Fetches the child view index representing the given position in the model.
FlowView,"insertUpdate(DocumentEvent changes, Shape a, ViewFactory f)",void,Gives notification that something was inserted into the document in a location that this view is responsible for.
FlowView,"layout(int width, int height)",protected void,Lays out the children.
FlowView,loadChildren(ViewFactory f),protected void,Loads all of the children to initialize the view.
FlowView,"removeUpdate(DocumentEvent changes, Shape a, ViewFactory f)",void,Gives notification that something was removed from the document in a location that this view is responsible for.
FlowView,setParent(View parent),void,Sets the parent of the view.
FlowView.FlowStrategy,"adjustRow(FlowView fv, int rowIndex, int desiredSpan, int x)",protected void,Adjusts the given row if possible to fit within the layout span.
FlowView.FlowStrategy,"changedUpdate(FlowView fv, DocumentEvent e, Rectangle alloc)",void,Gives notification from the document that attributes were changed in a location that this view is responsible for.
FlowView.FlowStrategy,"createView(FlowView fv, int startOffset, int spanLeft, int rowIndex)",protected View,Creates a view that can be used to represent the current piece of the flow.
FlowView.FlowStrategy,getLogicalView(FlowView fv),protected View,This method gives flow strategies access to the logical view of the FlowView.
FlowView.FlowStrategy,"insertUpdate(FlowView fv, DocumentEvent e, Rectangle alloc)",void,Gives notification that something was inserted into the document in a location that the given flow view is responsible for.
FlowView.FlowStrategy,layout(FlowView fv),void,Update the flow on the given FlowView.
FlowView.FlowStrategy,"layoutRow(FlowView fv, int rowIndex, int pos)",protected int,Creates a row of views that will fit within the layout span of the row.
FlowView.FlowStrategy,"removeUpdate(FlowView fv, DocumentEvent e, Rectangle alloc)",void,Gives notification that something was removed from the document in a location that the given flow view is responsible for.
GapContent,allocateArray(int len),protected Object,Allocate an array to store items of the type appropriate (which is determined by the subclass).
GapContent,createPosition(int offset),Position,Creates a position within the content that will track change as the content is mutated.
GapContent,getArray(),protected Object,Access to the array.
GapContent,getArrayLength(),protected int,Get the length of the allocated array.
GapContent,"getChars(int where, int len, Segment chars)",void,Retrieves a portion of the content.
GapContent,getGapEnd(),protected int,Access to the end of the gap.
GapContent,getGapStart(),protected int,Access to the start of the gap.
GapContent,"getPositionsInRange(Vector v, int offset, int length)",protected Vector,Returns a Vector containing instances of UndoPosRef for the Positions in the range offset to offset + length.
GapContent,"getString(int where, int len)",String,Retrieves a portion of the content.
GapContent,"insertString(int where, String str)",UndoableEdit,Inserts a string into the content.
GapContent,length(),int,Returns the length of the content.
GapContent,"remove(int where, int nitems)",UndoableEdit,Removes part of the content.
GapContent,"replace(int position, int rmSize, Object addItems, int addSize)",protected void,Replace the given logical position in the storage with the given new items.
GapContent,resetMarksAtZero(),protected void,Resets all the marks that have an offset of 0 to have an index of zero as well.
GapContent,shiftEnd(int newSize),protected void,"Make the gap bigger, moving any necessary data and updating the appropriate marks"
GapContent,shiftGap(int newGapStart),protected void,"Move the start of the gap to a new location, without changing the size of the gap."
GapContent,shiftGapEndUp(int newGapEnd),protected void,Adjust the gap end upward.
GapContent,shiftGapStartDown(int newGapStart),protected void,Adjust the gap end downward.
GapContent,"updateUndoPositions(Vector positions, int offset, int length)",protected void,Resets the location for all the UndoPosRef instances in positions.
GlyphView,"breakView(int axis, int p0, float pos, float len)",View,Breaks this view on the given axis at the given length.
GlyphView,"changedUpdate(DocumentEvent e, Shape a, ViewFactory f)",void,Gives notification from the document that attributes were changed in a location that this view is responsible for.
GlyphView,checkPainter(),protected void,Check to see that a glyph painter exists.
GlyphView,clone(),protected Object,Creates a shallow copy.
GlyphView,"createFragment(int p0, int p1)",View,Creates a view that represents a portion of the element.
GlyphView,getAlignment(int axis),float,Determines the desired alignment for this view along an axis.
GlyphView,getBackground(),Color,Fetch the background color to use to render the glyphs.
GlyphView,"getBreakWeight(int axis, float pos, float len)",int,Determines how attractive a break opportunity in this view is.
GlyphView,getEndOffset(),int,Fetches the portion of the model that this view is responsible for.
GlyphView,getFont(),Font,Fetch the font that the glyphs should be based upon.
GlyphView,getForeground(),Color,Fetch the foreground color to use to render the glyphs.
GlyphView,getGlyphPainter(),GlyphView.GlyphPainter,Fetch the currently installed glyph painter.
GlyphView,getMinimumSpan(int axis),float,Determines the minimum span for this view along an axis.
GlyphView,"getNextVisualPositionFrom(int pos, Position.Bias b, Shape a, int direction, Position.Bias[] biasRet)",int,Provides a way to determine the next visually represented model location that one might place a caret.
GlyphView,"getPartialSpan(int p0, int p1)",float,Determines the span along the same axis as tab expansion for a portion of the view.
GlyphView,getPreferredSpan(int axis),float,Determines the preferred span for this view along an axis.
GlyphView,getStartOffset(),int,Fetches the portion of the model that this view is responsible for.
GlyphView,"getTabbedSpan(float x, TabExpander e)",float,Determines the desired span when using the given tab expansion implementation.
GlyphView,getTabExpander(),TabExpander,Fetch the TabExpander to use if tabs are present in this view.
GlyphView,"getText(int p0, int p1)",Segment,Fetch a reference to the text that occupies the given range.
GlyphView,"insertUpdate(DocumentEvent e, Shape a, ViewFactory f)",void,Gives notification that something was inserted into the document in a location that this view is responsible for.
GlyphView,isStrikeThrough(),boolean,Determine if the glyphs should have a strikethrough line.
GlyphView,isSubscript(),boolean,Determine if the glyphs should be rendered as superscript.
GlyphView,isSuperscript(),boolean,Determine if the glyphs should be rendered as subscript.
GlyphView,isUnderline(),boolean,Determine if the glyphs should be underlined.
GlyphView,"modelToView(int pos, Shape a, Position.Bias b)",Shape,Provides a mapping from the document model coordinate space to the coordinate space of the view mapped to it.
GlyphView,"paint(Graphics g, Shape a)",void,Renders a portion of a text style run.
GlyphView,"removeUpdate(DocumentEvent e, Shape a, ViewFactory f)",void,Gives notification that something was removed from the document in a location that this view is responsible for.
GlyphView,setGlyphPainter(GlyphView.GlyphPainter p),void,Sets the painter to use for rendering glyphs.
GlyphView,"viewToModel(float x, float y, Shape a, Position.Bias[] biasReturn)",int,Provides a mapping from the view coordinate space to the logical coordinate space of the model.
GlyphView.GlyphPainter,getAscent(GlyphView v),abstract float,NULL
