ClassName,URL,Description
AbstractDocument,https://docs.oracle.com/javase/8/docs/api/javax/swing/text/AbstractDocument.html,An implementation of the document interface to serve as a basis for implementing various kinds of documents.
AbstractDocument.ElementEdit,https://docs.oracle.com/javase/8/docs/api/javax/swing/text/AbstractDocument.ElementEdit.html,An implementation of ElementChange that can be added to the document event.
AbstractWriter,https://docs.oracle.com/javase/8/docs/api/javax/swing/text/AbstractWriter.html,AbstractWriter is an abstract class that actually does the work of writing out the element tree including the attributes.
AsyncBoxView,https://docs.oracle.com/javase/8/docs/api/javax/swing/text/AsyncBoxView.html,A box that does layout asynchronously.
BoxView,https://docs.oracle.com/javase/8/docs/api/javax/swing/text/BoxView.html,A view that arranges its children into a box shape by tiling its children along an axis.
ComponentView,https://docs.oracle.com/javase/8/docs/api/javax/swing/text/ComponentView.html,Component decorator that implements the view interface.
CompositeView,https://docs.oracle.com/javase/8/docs/api/javax/swing/text/CompositeView.html,CompositeView is an abstract View implementation which manages one or more child views.
DateFormatter,https://docs.oracle.com/javase/8/docs/api/javax/swing/text/DateFormatter.html,DateFormatter is an InternationalFormatter that does its formatting by way of an instance of java.text.DateFormat.
DefaultCaret,https://docs.oracle.com/javase/8/docs/api/javax/swing/text/DefaultCaret.html,A default implementation of Caret.
DefaultEditorKit,https://docs.oracle.com/javase/8/docs/api/javax/swing/text/DefaultEditorKit.html,This is the set of things needed by a text component to be a reasonably functioning editor for some type of text document.
DefaultEditorKit.BeepAction,https://docs.oracle.com/javase/8/docs/api/javax/swing/text/DefaultEditorKit.BeepAction.html,Creates a beep.
DefaultEditorKit.CopyAction,https://docs.oracle.com/javase/8/docs/api/javax/swing/text/DefaultEditorKit.CopyAction.html,Copies the selected region and place its contents into the system clipboard.
DefaultEditorKit.CutAction,https://docs.oracle.com/javase/8/docs/api/javax/swing/text/DefaultEditorKit.CutAction.html,Cuts the selected region and place its contents into the system clipboard.
DefaultEditorKit.DefaultKeyTypedAction,https://docs.oracle.com/javase/8/docs/api/javax/swing/text/DefaultEditorKit.DefaultKeyTypedAction.html,The action that is executed by default if a key typed event is received and there is no keymap entry.
DefaultEditorKit.InsertBreakAction,https://docs.oracle.com/javase/8/docs/api/javax/swing/text/DefaultEditorKit.InsertBreakAction.html,Places a line/paragraph break into the document.
DefaultEditorKit.InsertContentAction,https://docs.oracle.com/javase/8/docs/api/javax/swing/text/DefaultEditorKit.InsertContentAction.html,Places content into the associated document.
DefaultEditorKit.InsertTabAction,https://docs.oracle.com/javase/8/docs/api/javax/swing/text/DefaultEditorKit.InsertTabAction.html,Places a tab character into the document.
DefaultEditorKit.PasteAction,https://docs.oracle.com/javase/8/docs/api/javax/swing/text/DefaultEditorKit.PasteAction.html,"Pastes the contents of the system clipboard into the selected region, or before the caret if nothing is selected."
DefaultFormatter,https://docs.oracle.com/javase/8/docs/api/javax/swing/text/DefaultFormatter.html,DefaultFormatter formats arbitrary objects.
DefaultFormatterFactory,https://docs.oracle.com/javase/8/docs/api/javax/swing/text/DefaultFormatterFactory.html,An implementation of JFormattedTextField.AbstractFormatterFactory.
DefaultHighlighter,https://docs.oracle.com/javase/8/docs/api/javax/swing/text/DefaultHighlighter.html,Implements the Highlighter interfaces.
DefaultHighlighter.DefaultHighlightPainter,https://docs.oracle.com/javase/8/docs/api/javax/swing/text/DefaultHighlighter.DefaultHighlightPainter.html,Simple highlight painter that fills a highlighted area with a solid color.
DefaultStyledDocument,https://docs.oracle.com/javase/8/docs/api/javax/swing/text/DefaultStyledDocument.html,A document that can be marked up with character and paragraph styles in a manner similar to the Rich Text Format.
DefaultStyledDocument.AttributeUndoableEdit,https://docs.oracle.com/javase/8/docs/api/javax/swing/text/DefaultStyledDocument.AttributeUndoableEdit.html,An UndoableEdit used to remember AttributeSet changes to an Element.
DefaultStyledDocument.ElementSpec,https://docs.oracle.com/javase/8/docs/api/javax/swing/text/DefaultStyledDocument.ElementSpec.html,Specification for building elements.
DefaultTextUI,https://docs.oracle.com/javase/8/docs/api/javax/swing/text/DefaultTextUI.html,NULL
DocumentFilter,https://docs.oracle.com/javase/8/docs/api/javax/swing/text/DocumentFilter.html,"DocumentFilter, as the name implies, is a filter for the Document mutation methods."
DocumentFilter.FilterBypass,https://docs.oracle.com/javase/8/docs/api/javax/swing/text/DocumentFilter.FilterBypass.html,Used as a way to circumvent calling back into the Document to change it.
EditorKit,https://docs.oracle.com/javase/8/docs/api/javax/swing/text/EditorKit.html,Establishes the set of things needed by a text component to be a reasonably functioning editor for some type of text content.
ElementIterator,https://docs.oracle.com/javase/8/docs/api/javax/swing/text/ElementIterator.html,"ElementIterator, as the name suggests, iterates over the Element tree."
FieldView,https://docs.oracle.com/javase/8/docs/api/javax/swing/text/FieldView.html,Extends the multi-line plain text view to be suitable for a single-line editor view.
FlowView,https://docs.oracle.com/javase/8/docs/api/javax/swing/text/FlowView.html,A View that tries to flow it's children into some partially constrained space.
FlowView.FlowStrategy,https://docs.oracle.com/javase/8/docs/api/javax/swing/text/FlowView.FlowStrategy.html,Strategy for maintaining the physical form of the flow.
GapContent,https://docs.oracle.com/javase/8/docs/api/javax/swing/text/GapContent.html,An implementation of the AbstractDocument.Content interface implemented using a gapped buffer similar to that used by emacs.
GlyphView,https://docs.oracle.com/javase/8/docs/api/javax/swing/text/GlyphView.html,A GlyphView is a styled chunk of text that represents a view mapped over an element in the text model.
GlyphView.GlyphPainter,https://docs.oracle.com/javase/8/docs/api/javax/swing/text/GlyphView.GlyphPainter.html,A class to perform rendering of the glyphs.
IconView,https://docs.oracle.com/javase/8/docs/api/javax/swing/text/IconView.html,Icon decorator that implements the view interface.
InternationalFormatter,https://docs.oracle.com/javase/8/docs/api/javax/swing/text/InternationalFormatter.html,"InternationalFormatter extends DefaultFormatter, using an instance of java.text.Format to handle the conversion to a String, and the conversion from a String."
JTextComponent,https://docs.oracle.com/javase/8/docs/api/javax/swing/text/JTextComponent.html,JTextComponent is the base class for swing text components.
JTextComponent.DropLocation,https://docs.oracle.com/javase/8/docs/api/javax/swing/text/JTextComponent.DropLocation.html,Represents a drop location for JTextComponents.
JTextComponent.KeyBinding,https://docs.oracle.com/javase/8/docs/api/javax/swing/text/JTextComponent.KeyBinding.html,Binding record for creating key bindings.
LabelView,https://docs.oracle.com/javase/8/docs/api/javax/swing/text/LabelView.html,A LabelView is a styled chunk of text that represents a view mapped over an element in the text model.
LayeredHighlighter,https://docs.oracle.com/javase/8/docs/api/javax/swing/text/LayeredHighlighter.html,NULL
LayeredHighlighter.LayerPainter,https://docs.oracle.com/javase/8/docs/api/javax/swing/text/LayeredHighlighter.LayerPainter.html,Layered highlight renderer.
LayoutQueue,https://docs.oracle.com/javase/8/docs/api/javax/swing/text/LayoutQueue.html,A queue of text layout tasks.
MaskFormatter,https://docs.oracle.com/javase/8/docs/api/javax/swing/text/MaskFormatter.html,MaskFormatter is used to format and edit strings.
NavigationFilter,https://docs.oracle.com/javase/8/docs/api/javax/swing/text/NavigationFilter.html,NavigationFilter can be used to restrict where the cursor can be positioned.
NavigationFilter.FilterBypass,https://docs.oracle.com/javase/8/docs/api/javax/swing/text/NavigationFilter.FilterBypass.html,Used as a way to circumvent calling back into the caret to position the cursor.
NumberFormatter,https://docs.oracle.com/javase/8/docs/api/javax/swing/text/NumberFormatter.html,NumberFormatter subclasses InternationalFormatter adding special behavior for numbers.
ParagraphView,https://docs.oracle.com/javase/8/docs/api/javax/swing/text/ParagraphView.html,"View of a simple line-wrapping paragraph that supports multiple fonts, colors, components, icons, etc."
PasswordView,https://docs.oracle.com/javase/8/docs/api/javax/swing/text/PasswordView.html,Implements a View suitable for use in JPasswordField UI implementations.
PlainDocument,https://docs.oracle.com/javase/8/docs/api/javax/swing/text/PlainDocument.html,A plain document that maintains no character attributes.
PlainView,https://docs.oracle.com/javase/8/docs/api/javax/swing/text/PlainView.html,Implements View interface for a simple multi-line text view that has text in one font and color.
Position.Bias,https://docs.oracle.com/javase/8/docs/api/javax/swing/text/Position.Bias.html,A typesafe enumeration to indicate bias to a position in the model.
Segment,https://docs.oracle.com/javase/8/docs/api/javax/swing/text/Segment.html,A segment of a character array representing a fragment of text.
SimpleAttributeSet,https://docs.oracle.com/javase/8/docs/api/javax/swing/text/SimpleAttributeSet.html,A straightforward implementation of MutableAttributeSet using a hash table.
StringContent,https://docs.oracle.com/javase/8/docs/api/javax/swing/text/StringContent.html,An implementation of the AbstractDocument.Content interface that is a brute force implementation that is useful for relatively small documents and/or debugging.
StyleConstants,https://docs.oracle.com/javase/8/docs/api/javax/swing/text/StyleConstants.html,A collection of well known or common attribute keys and methods to apply to an AttributeSet or MutableAttributeSet to get/set the properties in a typesafe manner.
StyleConstants.CharacterConstants,https://docs.oracle.com/javase/8/docs/api/javax/swing/text/StyleConstants.CharacterConstants.html,This is a typesafe enumeration of the well-known attributes that contribute to a character style.
StyleConstants.ColorConstants,https://docs.oracle.com/javase/8/docs/api/javax/swing/text/StyleConstants.ColorConstants.html,This is a typesafe enumeration of the well-known attributes that contribute to a color.
StyleConstants.FontConstants,https://docs.oracle.com/javase/8/docs/api/javax/swing/text/StyleConstants.FontConstants.html,This is a typesafe enumeration of the well-known attributes that contribute to a font.
StyleConstants.ParagraphConstants,https://docs.oracle.com/javase/8/docs/api/javax/swing/text/StyleConstants.ParagraphConstants.html,This is a typesafe enumeration of the well-known attributes that contribute to a paragraph style.
StyleContext,https://docs.oracle.com/javase/8/docs/api/javax/swing/text/StyleContext.html,A pool of styles and their associated resources.
StyledEditorKit,https://docs.oracle.com/javase/8/docs/api/javax/swing/text/StyledEditorKit.html,This is the set of things needed by a text component to be a reasonably functioning editor for some type of text document.
StyledEditorKit.AlignmentAction,https://docs.oracle.com/javase/8/docs/api/javax/swing/text/StyledEditorKit.AlignmentAction.html,An action to set paragraph alignment.
StyledEditorKit.BoldAction,https://docs.oracle.com/javase/8/docs/api/javax/swing/text/StyledEditorKit.BoldAction.html,An action to toggle the bold attribute.
StyledEditorKit.FontFamilyAction,https://docs.oracle.com/javase/8/docs/api/javax/swing/text/StyledEditorKit.FontFamilyAction.html,An action to set the font family in the associated JEditorPane.
StyledEditorKit.FontSizeAction,https://docs.oracle.com/javase/8/docs/api/javax/swing/text/StyledEditorKit.FontSizeAction.html,An action to set the font size in the associated JEditorPane.
StyledEditorKit.ForegroundAction,https://docs.oracle.com/javase/8/docs/api/javax/swing/text/StyledEditorKit.ForegroundAction.html,An action to set foreground color.
StyledEditorKit.ItalicAction,https://docs.oracle.com/javase/8/docs/api/javax/swing/text/StyledEditorKit.ItalicAction.html,An action to toggle the italic attribute.
StyledEditorKit.StyledTextAction,https://docs.oracle.com/javase/8/docs/api/javax/swing/text/StyledEditorKit.StyledTextAction.html,An action that assumes it's being fired on a JEditorPane with a StyledEditorKit (or subclass) installed.
StyledEditorKit.UnderlineAction,https://docs.oracle.com/javase/8/docs/api/javax/swing/text/StyledEditorKit.UnderlineAction.html,An action to toggle the underline attribute.
TableView,https://docs.oracle.com/javase/8/docs/api/javax/swing/text/TableView.html,"Implements View interface for a table, that is composed of an element structure where the child elements of the element this view is responsible for represent rows and the child elements of the row elements are cells."
TabSet,https://docs.oracle.com/javase/8/docs/api/javax/swing/text/TabSet.html,A TabSet is comprised of many TabStops.
TabStop,https://docs.oracle.com/javase/8/docs/api/javax/swing/text/TabStop.html,This class encapsulates a single tab stop (basically as tab stops are thought of by RTF).
TextAction,https://docs.oracle.com/javase/8/docs/api/javax/swing/text/TextAction.html,An Action implementation useful for key bindings that are shared across a number of different text components.
Utilities,https://docs.oracle.com/javase/8/docs/api/javax/swing/text/Utilities.html,A collection of methods to deal with various text related activities.
View,https://docs.oracle.com/javase/8/docs/api/javax/swing/text/View.html,A very important part of the text package is the View class.
WrappedPlainView,https://docs.oracle.com/javase/8/docs/api/javax/swing/text/WrappedPlainView.html,View of plain text (text with only one font and color) that does line-wrapping.
ZoneView,https://docs.oracle.com/javase/8/docs/api/javax/swing/text/ZoneView.html,ZoneView is a View implementation that creates zones for which the child views are not created or stored until they are needed for display or model/view translations.
