ClassName,URL,Description
DiagnosticCollector,https://docs.oracle.com/javase/8/docs/api/javax/tools/DiagnosticCollector.html,Provides an easy way to collect diagnostics in a list.
ForwardingFileObject,https://docs.oracle.com/javase/8/docs/api/javax/tools/ForwardingFileObject.html,Forwards calls to a given file object.
ForwardingJavaFileManager,https://docs.oracle.com/javase/8/docs/api/javax/tools/ForwardingJavaFileManager.html,Forwards calls to a given file manager.
ForwardingJavaFileObject,https://docs.oracle.com/javase/8/docs/api/javax/tools/ForwardingJavaFileObject.html,Forwards calls to a given file object.
SimpleJavaFileObject,https://docs.oracle.com/javase/8/docs/api/javax/tools/SimpleJavaFileObject.html,Provides simple implementations for most methods in JavaFileObject.
ToolProvider,https://docs.oracle.com/javase/8/docs/api/javax/tools/ToolProvider.html,"Provides methods for locating tool providers, for example, providers of compilers."
