Sample Number,ClassName,Snippet Number,Method,Exist,Description
0,PortableRemoteObject,1,PortableRemoteObject newInstance(Object impl),False,NULL
0,PortableRemoteObject,2,"PortableRemoteObject newInstance(Object impl, PortableRemoteObject p)",False,NULL
0,PortableRemoteObject,3,"PortableRemoteObject newInstance(Object impl, PortableRemoteObject p, int port)",False,NULL
0,PortableRemoteObject,4,"PortableRemoteObject newInstance(Object impl, PortableRemoteObject p, int port, int timeout)",False,NULL
0,PortableRemoteObject,5,"PortableRemoteObject newInstance(Object impl, PortableRemoteObject p, int port, int timeout, boolean export)",False,NULL
