ClassName,URL,Description
Date,https://docs.oracle.com/javase/8/docs/api/java/sql/Date.html,A thin wrapper around a millisecond value that allows JDBC to identify this as an SQL DATE value.
DriverManager,https://docs.oracle.com/javase/8/docs/api/java/sql/DriverManager.html,"The basic service for managing a set of JDBC drivers.NOTE: The DataSource interface, new in the JDBC 2.0 API, provides another way to connect to a data source."
DriverPropertyInfo,https://docs.oracle.com/javase/8/docs/api/java/sql/DriverPropertyInfo.html,Driver properties for making a connection.
SQLPermission,https://docs.oracle.com/javase/8/docs/api/java/sql/SQLPermission.html,"The permission for which the SecurityManager will check when code that is running an application with a SecurityManager enabled, calls the DriverManager.deregisterDriver method, DriverManager.setLogWriter method, DriverManager.setLogStream (deprecated) method, SyncFactory.setJNDIContext method, SyncFactory.setLogger method, Connection.setNetworktimeout method, or the Connection.abort method."
Time,https://docs.oracle.com/javase/8/docs/api/java/sql/Time.html,A thin wrapper around the java.util.Date class that allows the JDBC API to identify this as an SQL TIME value.
Timestamp,https://docs.oracle.com/javase/8/docs/api/java/sql/Timestamp.html,A thin wrapper around java.util.Date that allows the JDBC API to identify this as an SQL TIMESTAMP value.
Types,https://docs.oracle.com/javase/8/docs/api/java/sql/Types.html,"The class that defines the constants that are used to identify generic SQL types, called JDBC types."
