ClassName,Method,Return Type,Description
BasicAttribute,"add(int ix, Object attrVal)",void,Adds an attribute value to the ordered list of attribute values.
BasicAttribute,add(Object attrVal),boolean,Adds a new value to this attribute.
BasicAttribute,clear(),void,Removes all values from this attribute.
BasicAttribute,clone(),Object,Creates and returns a copy of this object.
BasicAttribute,contains(Object attrVal),boolean,Determines whether a value is in this attribute.
BasicAttribute,equals(Object obj),boolean,Determines whether obj is equal to this attribute.
BasicAttribute,get(),Object,Retrieves one of this attribute's values.
BasicAttribute,get(int ix),Object,Retrieves the attribute value from the ordered list of attribute values.
BasicAttribute,getAll(),NamingEnumeration<?>,Retrieves an enumeration of this attribute's values.
BasicAttribute,getAttributeDefinition(),DirContext,Retrieves this attribute's schema definition.
BasicAttribute,getAttributeSyntaxDefinition(),DirContext,Retrieves the syntax definition associated with this attribute.
BasicAttribute,getID(),String,Retrieves the id of this attribute.
BasicAttribute,hashCode(),int,Calculates the hash code of this attribute.
BasicAttribute,isOrdered(),boolean,Determines whether this attribute's values are ordered.
BasicAttribute,remove(int ix),Object,Removes an attribute value from the ordered list of attribute values.
BasicAttribute,remove(Object attrval),boolean,Removes a specified value from this attribute.
BasicAttribute,"set(int ix, Object attrVal)",Object,Sets an attribute value in the ordered list of attribute values.
BasicAttribute,size(),int,Retrieves the number of values in this attribute.
BasicAttribute,toString(),String,Generates the string representation of this attribute.
BasicAttributes,clone(),Object,Creates and returns a copy of this object.
BasicAttributes,equals(Object obj),boolean,"Determines whether this BasicAttributes is equal to another Attributes Two Attributes are equal if they are both instances of Attributes, treat the case of attribute IDs the same way, and contain the same attributes."
BasicAttributes,get(String attrID),Attribute,Retrieves the attribute with the given attribute id from the attribute set.
BasicAttributes,getAll(),NamingEnumeration<Attribute>,Retrieves an enumeration of the attributes in the attribute set.
BasicAttributes,getIDs(),NamingEnumeration<String>,Retrieves an enumeration of the ids of the attributes in the attribute set.
BasicAttributes,hashCode(),int,Calculates the hash code of this BasicAttributes.
BasicAttributes,isCaseIgnored(),boolean,Determines whether the attribute set ignores the case of attribute identifiers when retrieving or adding attributes.
BasicAttributes,put(Attribute attr),Attribute,Adds a new attribute to the attribute set.
BasicAttributes,"put(String attrID, Object val)",Attribute,Adds a new attribute to the attribute set.
BasicAttributes,remove(String attrID),Attribute,Removes the attribute with the attribute id 'attrID' from the attribute set.
BasicAttributes,size(),int,Retrieves the number of attributes in the attribute set.
BasicAttributes,toString(),String,Generates the string representation of this attribute set.
InitialDirContext,"bind(Name name, Object obj, Attributes attrs)",void,"Binds a name to an object, along with associated attributes."
InitialDirContext,"bind(String name, Object obj, Attributes attrs)",void,"Binds a name to an object, along with associated attributes."
InitialDirContext,"createSubcontext(Name name, Attributes attrs)",DirContext,"Creates and binds a new context, along with associated attributes."
InitialDirContext,"createSubcontext(String name, Attributes attrs)",DirContext,"Creates and binds a new context, along with associated attributes."
InitialDirContext,getAttributes(Name name),Attributes,Retrieves all of the attributes associated with a named object.
InitialDirContext,"getAttributes(Name name, String[] attrIds)",Attributes,Retrieves selected attributes associated with a named object.
InitialDirContext,getAttributes(String name),Attributes,Retrieves all of the attributes associated with a named object.
InitialDirContext,"getAttributes(String name, String[] attrIds)",Attributes,Retrieves selected attributes associated with a named object.
InitialDirContext,getSchema(Name name),DirContext,Retrieves the schema associated with the named object.
InitialDirContext,getSchema(String name),DirContext,Retrieves the schema associated with the named object.
InitialDirContext,getSchemaClassDefinition(Name name),DirContext,Retrieves a context containing the schema objects of the named object's class definitions.
InitialDirContext,getSchemaClassDefinition(String name),DirContext,Retrieves a context containing the schema objects of the named object's class definitions.
InitialDirContext,"modifyAttributes(Name name, int mod_op, Attributes attrs)",void,Modifies the attributes associated with a named object.
InitialDirContext,"modifyAttributes(Name name, ModificationItem[] mods)",void,Modifies the attributes associated with a named object using an ordered list of modifications.
InitialDirContext,"modifyAttributes(String name, int mod_op, Attributes attrs)",void,Modifies the attributes associated with a named object.
InitialDirContext,"modifyAttributes(String name, ModificationItem[] mods)",void,Modifies the attributes associated with a named object using an ordered list of modifications.
InitialDirContext,"rebind(Name name, Object obj, Attributes attrs)",void,"Binds a name to an object, along with associated attributes, overwriting any existing binding."
InitialDirContext,"rebind(String name, Object obj, Attributes attrs)",void,"Binds a name to an object, along with associated attributes, overwriting any existing binding."
InitialDirContext,"search(Name name, Attributes matchingAttributes)",NamingEnumeration<SearchResult>,Searches in a single context for objects that contain a specified set of attributes.
InitialDirContext,"search(Name name, Attributes matchingAttributes, String[] attributesToReturn)",NamingEnumeration<SearchResult>,"Searches in a single context for objects that contain a specified set of attributes, and retrieves selected attributes."
InitialDirContext,"search(Name name, String filterExpr, Object[] filterArgs, SearchControls cons)",NamingEnumeration<SearchResult>,Searches in the named context or object for entries that satisfy the given search filter.
InitialDirContext,"search(Name name, String filter, SearchControls cons)",NamingEnumeration<SearchResult>,Searches in the named context or object for entries that satisfy the given search filter.
InitialDirContext,"search(String name, Attributes matchingAttributes)",NamingEnumeration<SearchResult>,Searches in a single context for objects that contain a specified set of attributes.
InitialDirContext,"search(String name, Attributes matchingAttributes, String[] attributesToReturn)",NamingEnumeration<SearchResult>,"Searches in a single context for objects that contain a specified set of attributes, and retrieves selected attributes."
InitialDirContext,"search(String name, String filterExpr, Object[] filterArgs, SearchControls cons)",NamingEnumeration<SearchResult>,Searches in the named context or object for entries that satisfy the given search filter.
InitialDirContext,"search(String name, String filter, SearchControls cons)",NamingEnumeration<SearchResult>,Searches in the named context or object for entries that satisfy the given search filter.
ModificationItem,getAttribute(),Attribute,Retrieves the attribute associated with this modification item.
ModificationItem,getModificationOp(),int,Retrieves the modification code of this modification item.
ModificationItem,toString(),String,"Generates the string representation of this modification item, which consists of the modification operation and its related attribute."
SearchControls,getCountLimit(),long,Retrieves the maximum number of entries that will be returned as a result of the search.
SearchControls,getDerefLinkFlag(),boolean,Determines whether links will be dereferenced during the search.
SearchControls,getReturningAttributes(),String[],Retrieves the attributes that will be returned as part of the search.
SearchControls,getReturningObjFlag(),boolean,Determines whether objects will be returned as part of the result.
SearchControls,getSearchScope(),int,Retrieves the search scope of these SearchControls.
SearchControls,getTimeLimit(),int,Retrieves the time limit of these SearchControls in milliseconds.
SearchControls,setCountLimit(long limit),void,Sets the maximum number of entries to be returned as a result of the search.
SearchControls,setDerefLinkFlag(boolean on),void,Enables/disables link dereferencing during the search.
SearchControls,setReturningAttributes(String[] attrs),void,Specifies the attributes that will be returned as part of the search.
SearchControls,setReturningObjFlag(boolean on),void,Enables/disables returning objects returned as part of the result.
SearchControls,setSearchScope(int scope),void,"Sets the search scope to one of: OBJECT_SCOPE, ONELEVEL_SCOPE, SUBTREE_SCOPE."
SearchControls,setTimeLimit(int ms),void,Sets the time limit of these SearchControls in milliseconds.
SearchResult,getAttributes(),Attributes,Retrieves the attributes in this search result.
SearchResult,setAttributes(Attributes attrs),void,Sets the attributes of this search result to attrs.
SearchResult,toString(),String,Generates the string representation of this SearchResult.
